{
  "schemaVersion": 1,
  "generatedAt": "2026-09-30T02:25:21.570Z",
  "toolRevision": "48ebe5c4b93dc8b5ff19fcaea1aa0166cb441bb3",
  "harnessDigest": "32034feda983d0ab85e507654a49983085f48f7e23a8ec4039d094b79f3ddf81",
  "dataset": {
    "name": "testlore-routing-controlled-v1",
    "scope": "12 deterministic changes in four controlled 8-test Node projects; JSON asset contracts, no real browser or external services",
    "scenarios": 12,
    "projects": 4,
    "plantedRegressions": 7,
    "digest": "2a2ea05cfda34d4d99c9e5d1d35ecf6c38fec6ece35b7b2a971a757c0867cf0c",
    "setup": "Native discovery; declared browser-route inputs; cold run history before every measured method; baseline setup outside timing."
  },
  "repetitions": 3,
  "environment": {
    "node": "v22.19.0",
    "platform": "darwin",
    "architecture": "arm64",
    "cpu": "Apple M4 Pro"
  },
  "methods": [
    {
      "id": "full-native",
      "name": "Full native Node suite",
      "kind": "actual-native-runner"
    },
    {
      "id": "testlore",
      "name": "TestLore routing",
      "kind": "actual-tool-native-discovery"
    },
    {
      "id": "imports-only",
      "name": "JS imports only (diagnostic)",
      "kind": "diagnostic-heuristic-not-a-competitor"
    }
  ],
  "summary": [
    {
      "id": "full-native",
      "name": "Full native Node suite",
      "kind": "actual-native-runner",
      "valid": true,
      "trials": 36,
      "totalFaults": 63,
      "detectedFaults": 63,
      "faultRecall": 1,
      "faultyScenarioTrials": 21,
      "detectedScenarioTrials": 21,
      "faultScenarioRecall": 1,
      "missedFailures": 0,
      "executedFiles": 288,
      "availableFiles": 288,
      "executedFileFraction": 1,
      "endToEndMedianMs": 135,
      "endToEndTotalMs": 4997,
      "limitations": []
    },
    {
      "id": "testlore",
      "name": "TestLore routing",
      "kind": "actual-tool-native-discovery",
      "valid": true,
      "trials": 36,
      "totalFaults": 63,
      "detectedFaults": 63,
      "faultRecall": 1,
      "faultyScenarioTrials": 21,
      "detectedScenarioTrials": 21,
      "faultScenarioRecall": 1,
      "missedFailures": 0,
      "executedFiles": 165,
      "availableFiles": 288,
      "executedFileFraction": 0.5729166666666666,
      "endToEndMedianMs": 564,
      "endToEndTotalMs": 20105,
      "limitations": []
    },
    {
      "id": "imports-only",
      "name": "JS imports only (diagnostic)",
      "kind": "diagnostic-heuristic-not-a-competitor",
      "valid": true,
      "trials": 36,
      "totalFaults": 63,
      "detectedFaults": 27,
      "faultRecall": 0.42857142857142855,
      "faultyScenarioTrials": 21,
      "detectedScenarioTrials": 6,
      "faultScenarioRecall": 0.2857142857142857,
      "missedFailures": 36,
      "executedFiles": 33,
      "availableFiles": 288,
      "executedFileFraction": 0.11458333333333333,
      "endToEndMedianMs": 2,
      "endToEndTotalMs": 1306,
      "limitations": [
        "Deliberately limited diagnostic baseline, not an existing competing product."
      ]
    }
  ],
  "trials": [
    {
      "scenario": "leaf-comment",
      "project": "modular",
      "regression": false,
      "repetition": 0,
      "order": [
        "full-native",
        "testlore",
        "imports-only"
      ],
      "method": "full-native",
      "totalFiles": 8,
      "plannedFiles": [
        "test/0.test.js",
        "test/1.test.js",
        "test/2.test.js",
        "test/3.test.js",
        "test/4.test.js",
        "test/5.test.js",
        "test/6.test.js",
        "test/7.test.js"
      ],
      "executedFiles": [
        "test/0.test.js",
        "test/1.test.js",
        "test/2.test.js",
        "test/3.test.js",
        "test/4.test.js",
        "test/5.test.js",
        "test/6.test.js",
        "test/7.test.js"
      ],
      "endToEndMs": 131,
      "executionMs": 131,
      "observedFailures": [],
      "groundTruthFailures": [],
      "detectedFailures": [],
      "missedFailures": [],
      "valid": true,
      "rawReport": "leaf-comment-0-full-native.json"
    },
    {
      "scenario": "leaf-comment",
      "project": "modular",
      "regression": false,
      "repetition": 0,
      "order": [
        "full-native",
        "testlore",
        "imports-only"
      ],
      "method": "testlore",
      "totalFiles": 8,
      "plannedFiles": [
        "test/0.test.js"
      ],
      "executedFiles": [
        "test/0.test.js"
      ],
      "endToEndMs": 582,
      "executionMs": 102,
      "observedFailures": [],
      "groundTruthFailures": [],
      "detectedFailures": [],
      "missedFailures": [],
      "valid": true,
      "rawReport": "leaf-comment-0-testlore.json"
    },
    {
      "scenario": "leaf-comment",
      "project": "modular",
      "regression": false,
      "repetition": 0,
      "order": [
        "full-native",
        "testlore",
        "imports-only"
      ],
      "method": "imports-only",
      "totalFiles": 8,
      "plannedFiles": [
        "test/0.test.js"
      ],
      "executedFiles": [
        "test/0.test.js"
      ],
      "endToEndMs": 95,
      "executionMs": 92,
      "observedFailures": [],
      "groundTruthFailures": [],
      "detectedFailures": [],
      "missedFailures": [],
      "valid": true,
      "rawReport": "leaf-comment-0-imports-only.json"
    },
    {
      "scenario": "leaf-comment",
      "project": "modular",
      "regression": false,
      "repetition": 1,
      "order": [
        "testlore",
        "imports-only",
        "full-native"
      ],
      "method": "testlore",
      "totalFiles": 8,
      "plannedFiles": [
        "test/0.test.js"
      ],
      "executedFiles": [
        "test/0.test.js"
      ],
      "endToEndMs": 530,
      "executionMs": 95,
      "observedFailures": [],
      "groundTruthFailures": [],
      "detectedFailures": [],
      "missedFailures": [],
      "valid": true,
      "rawReport": "leaf-comment-1-testlore.json"
    },
    {
      "scenario": "leaf-comment",
      "project": "modular",
      "regression": false,
      "repetition": 1,
      "order": [
        "testlore",
        "imports-only",
        "full-native"
      ],
      "method": "imports-only",
      "totalFiles": 8,
      "plannedFiles": [
        "test/0.test.js"
      ],
      "executedFiles": [
        "test/0.test.js"
      ],
      "endToEndMs": 95,
      "executionMs": 93,
      "observedFailures": [],
      "groundTruthFailures": [],
      "detectedFailures": [],
      "missedFailures": [],
      "valid": true,
      "rawReport": "leaf-comment-1-imports-only.json"
    },
    {
      "scenario": "leaf-comment",
      "project": "modular",
      "regression": false,
      "repetition": 1,
      "order": [
        "testlore",
        "imports-only",
        "full-native"
      ],
      "method": "full-native",
      "totalFiles": 8,
      "plannedFiles": [
        "test/0.test.js",
        "test/1.test.js",
        "test/2.test.js",
        "test/3.test.js",
        "test/4.test.js",
        "test/5.test.js",
        "test/6.test.js",
        "test/7.test.js"
      ],
      "executedFiles": [
        "test/0.test.js",
        "test/1.test.js",
        "test/2.test.js",
        "test/3.test.js",
        "test/4.test.js",
        "test/5.test.js",
        "test/6.test.js",
        "test/7.test.js"
      ],
      "endToEndMs": 145,
      "executionMs": 145,
      "observedFailures": [],
      "groundTruthFailures": [],
      "detectedFailures": [],
      "missedFailures": [],
      "valid": true,
      "rawReport": "leaf-comment-1-full-native.json"
    },
    {
      "scenario": "leaf-comment",
      "project": "modular",
      "regression": false,
      "repetition": 2,
      "order": [
        "imports-only",
        "full-native",
        "testlore"
      ],
      "method": "imports-only",
      "totalFiles": 8,
      "plannedFiles": [
        "test/0.test.js"
      ],
      "executedFiles": [
        "test/0.test.js"
      ],
      "endToEndMs": 94,
      "executionMs": 92,
      "observedFailures": [],
      "groundTruthFailures": [],
      "detectedFailures": [],
      "missedFailures": [],
      "valid": true,
      "rawReport": "leaf-comment-2-imports-only.json"
    },
    {
      "scenario": "leaf-comment",
      "project": "modular",
      "regression": false,
      "repetition": 2,
      "order": [
        "imports-only",
        "full-native",
        "testlore"
      ],
      "method": "full-native",
      "totalFiles": 8,
      "plannedFiles": [
        "test/0.test.js",
        "test/1.test.js",
        "test/2.test.js",
        "test/3.test.js",
        "test/4.test.js",
        "test/5.test.js",
        "test/6.test.js",
        "test/7.test.js"
      ],
      "executedFiles": [
        "test/0.test.js",
        "test/1.test.js",
        "test/2.test.js",
        "test/3.test.js",
        "test/4.test.js",
        "test/5.test.js",
        "test/6.test.js",
        "test/7.test.js"
      ],
      "endToEndMs": 142,
      "executionMs": 141,
      "observedFailures": [],
      "groundTruthFailures": [],
      "detectedFailures": [],
      "missedFailures": [],
      "valid": true,
      "rawReport": "leaf-comment-2-full-native.json"
    },
    {
      "scenario": "leaf-comment",
      "project": "modular",
      "regression": false,
      "repetition": 2,
      "order": [
        "imports-only",
        "full-native",
        "testlore"
      ],
      "method": "testlore",
      "totalFiles": 8,
      "plannedFiles": [
        "test/0.test.js"
      ],
      "executedFiles": [
        "test/0.test.js"
      ],
      "endToEndMs": 505,
      "executionMs": 90,
      "observedFailures": [],
      "groundTruthFailures": [],
      "detectedFailures": [],
      "missedFailures": [],
      "valid": true,
      "rawReport": "leaf-comment-2-testlore.json"
    },
    {
      "scenario": "leaf-defect",
      "project": "modular",
      "regression": true,
      "repetition": 0,